{
  "schema_version": "1.0.0",
  "record_id": "record.literature_source.orthogonal_scores.2018",
  "generation_id": "generation.literature_source.001",
  "source_id": "citation.orthogonal_scores.2018",
  "source_type": "journal_article",
  "title": "Double or debiased machine learning for treatment and structural parameters",
  "authors": [
    "Victor Chernozhukov",
    "Denis Chetverikov",
    "Mert Demirer",
    "Esther Duflo",
    "Christian Hansen",
    "Whitney Newey",
    "James Robins"
  ],
  "year": 2018,
  "venue": "The Econometrics Journal",
  "identifiers": [
    {
      "kind": "doi",
      "value": "10.1111/ectj.12097"
    }
  ],
  "search_provenance": [
    {
      "run_id": "run.p1.literature.20260701t100000z",
      "role": "theorist",
      "search_source": "Crossref",
      "query": "orthogonal scores cross-fitting treatment effects",
      "searched_at": "2026-07-01T10:10:00Z"
    }
  ],
  "source_status": "active",
  "content_sha256": "2323232323232323232323232323232323232323232323232323232323232323",
  "created_at": "2026-07-01T11:00:00Z",
  "updated_at": "2026-07-01T11:00:00Z",
  "authority_at_creation": "formal_generation",
  "publication_receipt_id": "publication.p1.literature.003",
  "published_at": "2026-07-10T09:20:00Z"
}
